{
 "authority": {
  "bytes": 16515,
  "commit": "66fec8af948e4c21c6818d0007bd2b3619738b4e",
  "git_blob": "428af94069adffb9636499313405d7c1153445ab",
  "newline_convention": "LF only, no BOM, exactly one trailing newline",
  "path": "studies/study3/prompts/study3_v0_7_single_focused_methods_review_authority.md",
  "published_alone_as_the_first_commit_after_the_reviewed_target": true,
  "sha256": "83d5d21975601ad99b505ed7e35dad263fb453e503752ebf2b5d5f78c12f7c5b",
  "tree": "d717130936e4bd7537fe0862f3d6a7826fe7b283"
 },
 "boundary": {
  "evidence_ledger_tail": "EV-0016",
  "formal_execution_authorized": false,
  "historical_protected_paths_changed": 0,
  "prohibited_operation_counters": {
   "activation_loads": 0,
   "adapter_loads": 0,
   "azure_acr_aca_gpu_cloud_operations": 0,
   "checkpoint_downloads": 0,
   "checkpoint_loads": 0,
   "checkpoint_resolutions": 0,
   "confirmation_accesses": 0,
   "evidence_rows_added": 0,
   "forward_passes": 0,
   "generations": 0,
   "interface_qualifications": 0,
   "interface_selections": 0,
   "logit_reads": 0,
   "model_output_parses": 0,
   "model_weight_loads": 0,
   "prefills": 0,
   "rp_b_qualifications": 0,
   "rp_m_qualifications": 0,
   "scientific_evidence_claims": 0,
   "scoring_operations": 0,
   "seeds_drawn": 0,
   "split_realizations": 0,
   "task_bank_rows_generated": 0,
   "tokenizer_constructions": 0,
   "tokenizer_decodes": 0,
   "tokenizer_encodes": 0
  },
  "research_question_answered": false,
  "reviewed_candidate_paths_changed": 0
 },
 "findings": [
  {
   "affected": "Which document an executor must obey; every rule that differs between the legacy v0.5 JSON and draft-v0.7; the JSON/Markdown agreement guarantee.",
   "authority_section": "5.1, 5.4",
   "creates_operator_discretion": true,
   "evidence": [
    "status.authoritative_artifact reads: 'The JSON document interface_calibration_protocol_draft.json is the authoritative record of this design.' That names the legacy unversioned v0.5 JSON.",
    "protocol_placement_v0_7.sole_top_level_normative_protocol reads 'studies/study3/protocol/interface_calibration_protocol_draft_v0_7.json'.",
    "The current pointer sets must_not_load_interface_calibration_protocol_draft_json = true and fallback_to_legacy_permitted = false.",
    "status.authoritative_artifact also states that JSON/Markdown agreement 'is enforced by the committed test at tests/test_study3_design.py'. That file contains 0 occurrences of 'v0_7' and 2 occurrences of 'interface_calibration_protocol_draft.json', so it binds the legacy pair only."
   ],
   "id": "S3V07-B01",
   "minimal_operator_decision": "Decide whether status.authoritative_artifact is rewritten to name the v0.7 JSON and a v0.7 agreement test, or is mechanically demoted to a historical field excluded from active interpretation.",
   "paths_and_fields": [
    "studies/study3/protocol/interface_calibration_protocol_draft_v0_7.json -> status.authoritative_artifact",
    "studies/study3/protocol/interface_calibration_protocol_draft_v0_7.json -> protocol_placement_v0_7.sole_top_level_normative_protocol",
    "studies/study3/protocol/interface_calibration_protocol_current.json -> loader_contract.must_not_load_interface_calibration_protocol_draft_json",
    "tests/test_study3_design.py"
   ],
   "reviewer_implemented_a_repair": false,
   "severity": "BLOCKING",
   "title": "Two active fields name different top-level normative protocols",
   "why_existing_tests_did_or_did_not_detect_it": "No committed test compares status.authoritative_artifact with protocol_placement_v0_7.sole_top_level_normative_protocol. test_the_legacy_bundle_is_labelled_historical_everywhere inspects the pointer and the amendment, not this field, and test_the_legacy_files_do_not_carry_the_new_status_string only checks the legacy files."
  },
  {
   "affected": "Every active scoring and rendering rule: prompt bytes, separators, instructions, label alphabets, answer cue, encoding policy and the first-discriminative-token scoring boundary. No executor can render or score an item from the active bundle alone.",
   "authority_section": "5.1",
   "creates_operator_discretion": true,
   "evidence": [
    "The v0.7 registry records inherited_v0_6_scoring_boundary with why = 'the v0.6 first-discriminative-token scoring boundary is normative and is inherited byte-identically by reference'.",
    "provenance_v0_7.derived_from lists the v0.6 registry with role 'normative v0.6 scoring and rendering registry'.",
    "The current pointer's active_bundle contains exactly four paths: the v0.7 protocol JSON, schema, Markdown and v0.7 registry. The v0.6 registry is in neither the pointer's active_bundle nor the amendment's new_bundle (seven paths), while must_resolve_only_to_the_versioned_v0_7_bundle = true and fallback_to_legacy_permitted = false.",
    "The v0.7 registry is 3,243 bytes and holds only answer surfaces, roles, wrapper arms and a pointer. The v0.6 registry is 57,331 bytes and is the only committed home of question_stem_templates, instructions, separators, label_alphabets, answer_cue, placeholders, encoding_policy, token_accounting, pair_isolation_rules, renderings, scoring_boundary, applicability_table and 22 hashed normative template assets.",
    "The v0.6 registry itself states binding_status 'BINDING_NORMATIVE_INPUT_NOT_AN_ILLUSTRATIVE_EXAMPLE. An independent implementation must be able to produce every applicable prompt byte from this registry alone', governs 'studies/study3/protocol/interface_calibration_protocol_draft.json registers this file as a binding input', supersedes the v0.5 registry, and carries state 'STUDY3_INTERFACE_CALIBRATION_PROTOCOL_DRAFT_V0_6_COMPLETE_AWAITING_FINAL_FOCUSED_METHODS_REVIEW'.",
    "protocol_placement_v0_7 asserts the opposite of the registry: legacy_and_v0_6_are_provenance_inputs_not_runtime_overlays = true, while provenance_v0_7 asserts self_contained = true and executor_must_layer_amendments_manually = false."
   ],
   "id": "S3V07-B02",
   "minimal_operator_decision": "Decide whether the v0.6 registry is added to the sealed active bundle as a subordinate normative asset with an exact path and hash, or its content is carried into the v0.7 registry so the active bundle is genuinely closed.",
   "paths_and_fields": [
    "studies/study3/protocol/interface_calibration_rendering_registry_v0_7.json -> inherited_v0_6_scoring_boundary",
    "studies/study3/protocol/interface_calibration_protocol_draft_v0_7.json -> provenance_v0_7.derived_from[].role",
    "studies/study3/protocol/interface_calibration_protocol_draft_v0_7.json -> provenance_v0_7.self_contained",
    "studies/study3/protocol/interface_calibration_protocol_draft_v0_7.json -> provenance_v0_7.executor_must_layer_amendments_manually",
    "studies/study3/protocol/interface_calibration_protocol_draft_v0_7.json -> protocol_placement_v0_7.legacy_and_v0_6_are_provenance_inputs_not_runtime_overlays",
    "studies/study3/protocol/interface_calibration_protocol_current.json -> active_bundle",
    "studies/study3/protocol/interface_calibration_protocol_current.json -> loader_contract.must_resolve_only_to_the_versioned_v0_7_bundle",
    "studies/study3/protocol/interface_calibration_rendering_registry_v0_6.json -> binding_status, governs, supersedes, state"
   ],
   "reviewer_implemented_a_repair": false,
   "severity": "BLOCKING",
   "title": "The active bundle omits the v0.6 rendering registry that the v0.7 registry declares normative, so the active protocol is not self-contained",
   "why_existing_tests_did_or_did_not_detect_it": "test_the_protocol_is_self_contained asserts only the two self-declared booleans in provenance_v0_7 and that the v0.7 protocol has every top-level key the legacy protocol had. It never checks that a normative dependency is reachable inside the active bundle. test_every_recorded_pointer_hash_matches_the_file_on_disk only hashes the four paths the pointer already lists."
  },
  {
   "affected": "L, the candidate-level Bonferroni denominator (study development screening alpha 1/200 divided by L), Gate I4, stage P3-Q, and freeze eligibility.",
   "authority_section": "5.2",
   "creates_operator_discretion": true,
   "evidence": [
    "blocking_decisions is ['OD2']. OD2 carries status 'unresolved', blocking true, and blocks ['Gate I4', 'stage P3-Q', 'freeze', 'every quantity in the positive_reference_external_P3Q work stream'].",
    "q0_and_rp_b_v0_7.ladder.blocked_on = 'OD2' and deterministic_deferrals_v0_7 DEFER-02 blocked_on = 'OD2'.",
    "ladder.priority reads 'same-tokenizer natural candidates first, including the predeclared Qwen-family size ladder where eligible'. An exhaustive search of the committed protocol bytes finds six occurrences of 'Qwen': three are checkpoint_roles target identities (deepseek-ai/DeepSeek-R1-Distill-Qwen-1.5B, Qwen/Qwen2.5-Math-1.5B, Qwen/Qwen2.5-Math-1.5B-Instruct) and one is this sentence. No predeclared Qwen-family size ladder exists anywhere in the protocol.",
    "The only candidate universe registered is three generic families in positive_reference_candidates.candidate_families_for_operator_consideration: '3B-class instruction-tuned general model', '7B-class instruction-tuned general or math model', 'hosted or larger-SKU reference'. The strings 'candidate universe' and 'observation date' do not occur in the protocol.",
    "Three of the five eligibility predicates require judgement at seal time: 'license permitting research use and redistribution of derived measurements', 'runnable on the registered route', and 'natural model, not a training-constructed implicit-CoT or direct-answer model'. The ordering tie-break 'publication time' names no frozen source.",
    "numerical_closure_v0_7.operator_discretion_clause_count = 0 is therefore false, and every_execution_value_is_frozen_or_deterministically_deferred = true is not established for DEFER-02."
   ],
   "id": "S3V07-B03",